{
  "schema_version": "0.1",
  "world_id": "mist_harbor",
  "secrets": [
    {
      "id": "secret_kadga_logs",
      "owner_actor_id": "npc_kadga",
      "statement": "卡德加二十年前为黑雾教徒造过船，认得雾中灯笼阵的标记，这手艺如今成了他的把柄。",
      "importance": 800,
      "reveal_conditions": ["high_trust", "owner_confession"]
    },
    {
      "id": "secret_weila_fog",
      "owner_actor_id": "npc_weila",
      "statement": "薇拉体内封着一段活雾，每次驱雾都在消耗自己的记忆，她已经想不起故乡的名字。",
      "importance": 850,
      "reveal_conditions": ["direct_witness", "owner_confession", "quest_reveal"]
    },
    {
      "id": "secret_oun_ledger",
      "owner_actor_id": "npc_oun",
      "statement": "欧恩对齐的三份账目里，有一份记录着守望会高层向走私帮出售风晶粉的证据。",
      "importance": 900,
      "reveal_conditions": ["quest_reveal", "director_event"]
    }
  ],
  "plot_seeds": [
    {
      "id": "plot_light_failure",
      "premise": "灯塔的风晶粉储备只够七夜，而补货航道正被黑雾与暗礁同时封锁，港口必须在真相与秩序之间做出选择。",
      "involved_actor_ids": ["npc_kadga", "npc_weila", "npc_oun"],
      "severity": 750,
      "earliest_day": 1
    }
  ]
}
